,会社名,求人タイトル,項目C
0,株式会社ボードルア | ★マザーズ上場企業★残業ほぼなし★完全週休2日(年休125日以上),マンツーマン研修で【初級ITエンジニア】デビュー★100％未経験 正社員,
1,光ビジネスフォーム株式会社 | ジャスダック上場*テレワーク導入*大手や官公庁と取引*年休123日,未経験歓迎！【企画営業】＊20代活躍中＊土日祝休＊フレックス制 正社員,
2,株式会社ミックウェア | 「マネー・タイム・フリー」に特化した3つの働き方を選べます！,【ITエンジニア】最先端の開発環境★車の新しい価値を創造！ 正社員,
3,"コクー株式会社 | ""EXCEL女子事業""を展開◆年休124日以上◆副業OK◆月給30万以上も","""データに強い""人材へ【IT事務】★女性活躍中 ★豊富な研修制度 正社員",
4,株式会社テレマ | プライム案件80%、残業ほぼなし、土日祝休み、年間休日125日,理想の転職が手に入る【初級エンジニア】自社内／在宅ワーク可 正社員,
5,株式会社TERASS | 【自由な働き方】×【高収入】を実現可能！,ノルマなしの【不動産仲介エージェント】経験者募集/名古屋担当 業務委託,
6,株式会社プラウドグロリア | ★土日祝休み★年間休日125日以上★リモートワークあり,未経験歓迎！PCに触ったことがない方でもOK☆【ITエンジニア】 正社員,
7,株式会社メイテックフィルダーズ | 【東証一部上場／グループ企業】ITスキルをしっかり磨ける,充実研修で安心！ゼロから始める【ITエンジニア】※理系卒採用 正社員,
8,シエルプレザン合同会社 | 【20代中心に活躍中】個々のペースを尊重する、居心地の良い会社,【ITエンジニア】★完全土日祝休 ★残業月平均10h程 ★WEB面接OK 正社員,
9,株式会社スタッフサービス | 【面接1回】未経験でも安心の研修＆サポート制度★年間休日125日,在宅あり★お休みたっぷり【総合職(商品企画など)】女性活躍中♪ 正社員,
10,京セラ株式会社 | 【200名規模の大量採用】Web面接可／独身寮／高卒メンバー活躍中,【総合職(製造・設備保全・品質保証)】年休124日★賞与5.8ヶ月分 正社員,
11,株式会社エージェントゲート | 大手企業とも取引/残業基本なし/リモート勤務有/年休130日,未経験歓迎★IT業界に挑戦★【SEサポート・PMO補佐】 正社員,
12,株式会社根本杏林堂 | 総合病院で圧倒的シェアを誇る医療機器メーカー★年休124日,多くの医療現場を支える【組込ソフト設計】★新商品開発案件あり 正社員,
13,株式会社ネクストワン | ＼創立20周年突破／◆年間休日125日◆土日祝休み◆残業月20H程度,人財力100認定企業！ITスクールでゼロから成長【ITエンジニア】 正社員,
14,クオリティソフト株式会社 | クラウドセキュリティサービス『ISM CloudOne』◆年間休日126日,【提案営業】完全自社製品／国内シェアNo.1 ／若手活躍中！ 正社員,
15,株式会社リクルートスタッフィング | リクルートグループの正社員に♪在宅ワークも実施中,20代女性活躍中♪【営業事務】月給制＆賞与年2回★土日祝休み 正社員,
16,四葉システム開発株式会社 | ★年間休日125日 ★土日祝休み ★連休取得も可能 ★残業少なめ,官公庁案件が中心！【自社内開発エンジニア】★賞与実績5.5ヶ月 正社員,
17,株式会社インフォム | ◆残業ほぼなし◆完全週休2日制◆年間休日120日以上◆直行直帰OK,既存顧客のオーナー様へ【企画営業】※未経験歓迎・土日祝休み！ 正社員,
18,株式会社メイテック | 東証一部上場企業／大手企業で最上流から携わる／年収UP事例多数,【ITエンジニア】AI/5G/自動運転など最先端案件多数！40代活躍中 正社員,
19,Modis株式会社 | 旧社名：株式会社VSN,【コンサル型PM（自社内開発）】※年収700～1500万円可能 正社員,
20,グルーコードテクノロジーズ株式会社 | 【グルーコードグループ】★コロナ禍でも成長／積極採用中,★リモート9割／残業ほぼなし／自社内...etc【プログラマー】 正社員,
21,株式会社エージェントゲート　 | WOMAN's VALUE AWARD/残業基本なし/リモート勤務も実施中,年休130日！IT業界・事務未経験OK！安定の手に職を【IT事務】 正社員,
22,株式会社リクルート | 旅行領域★年間休日145日／完全週休2日制／男性の育休取得実績有,【企画営業(じゃらん)】◎未経験歓迎◆全国募集◆土日祝休み 正社員,
23,株式会社オブジェクティブコード | 月平均残業6.8時間◆年間休日135日以上取得可能！,十人十色全肯定！キャリアも給与もマイペースの【ITサポート】 正社員,
24,株式会社セレブリックス | ◆博報堂グループ◆若手社員中心に活躍中◆未経験でも月27.7万円,「未経験の僕がヒーローになれました」挑戦歓迎！【店舗営業】 正社員,
25,AJ・Flat株式会社 | ◎独自の評価制度があるから前給120％以上も実現可！◎年休128日,社内通貨制度で努力を見える化して評価！【PG・SE】*高卒以上 正社員,
26,クリエイトソリューションズ株式会社 | <7期連続増収増益>成長企業でありながら大手並みの福利厚生完備,"""エンジニア志望""大歓迎★【SE・PG】※完休2日・残業ほぼなし 正社員",
27,株式会社エージェントゲート | 定着率94%★Web面談実施中★年収120万UPでスタートの経験者も！,【ITエンジニア】★年休130日★　※高卒以上 正社員,
28,株式会社サムライ・ソフト | 累計750万DLアプリ開発実績有｜ブロックチェーンゲームで世界へ,【ブロックチェーンゲームエンジニア】未経験OK／フルリモート 正社員,
29,株式会社メイテックフィルダーズ | 【東証一部上場／グループ企業】年収100万UPした先輩も！,ゼロからモノづくりの技術を！【設計エンジニア】※理系卒歓迎 正社員,
30,ICT・イノベーター株式会社 | 学歴不問★入社支度金+お祝金50万円～70万円★福利厚生充実企業,【PCサポート】ネットワーク・サーバエンジニアにキャリアUP！ 正社員,
31,株式会社エージェントゲート | ビッグプロジェクトにも参画！大手プライム多数/前給最大限考慮,年収900万～可！数十名以上を管理する規模多数【PL・PM】 正社員,
32,株式会社メイテックフィルダーズ | 東証一部上場グループ／前職から年収100万UPした先輩も！,【ITエンジニア】最先端領域でスキルアップ！※経験者採用 正社員,
33,株式会社アーバン・ウェブ | ★テレワーク導入 ★有給消化ほぼ100％ ★残業月20時間以内,【システムエンジニア】★経験者は前職給与保証 正社員,
34,株式会社フレスタ | システム開発サービスで急成長!◎フリーランスも目指せる/副業OK,★未経験歓迎★【開発エンジニア】定着率90％/残業月平均6.5h 正社員,
35,株式会社エージェントゲート | 化粧品、メーカー、ゲームなど大手と取引★土日祝休★年休130日,【フロントエンドエンジニア】定着率94％★常時1600の豊富な案件 正社員,
36,株式会社アイエスエフネット | ★転職で年収が200万円UPの先輩も！未経験者大歓迎◎,【ITサポート（ヘルプデスク・エンジニア）】年休126日/広島採用 正社員,
37,株式会社Ｃａｒｅｃｏｎ | #年間休日120日以上#完全週休2日（土日休み）#リモートワークOK,【初級ITエンジニア】★最大6ヵ月の自社内研修★未経験歓迎 正社員,
38,AIGATEキャリア株式会社 | 同期入社★転勤なし★完休2日★年休120日★年収500万以上可,"【営業スタッフ】""未経験から始める""人材ビジネス★残業10H以内 正社員",
39,株式会社エージェントゲート | 化粧品メーカー等と取引/産育休取得＆復帰100％/残業基本なし,未経験OK★希望の働き方に変えよう*年休130日【ITヘルプデスク】 正社員,
40,株式会社リクルートスタッフィング情報サービス | スキルを身に付けワンランクアップできる★賞与年2回★WEB面接OK,未経験歓迎♪【ITエンジニア総合職】残業少なめ&年間休日124日♪ 正社員,
41,株式会社トーガシ | 展示会・イベント事業で成長を続ける安定企業 ◎年休120日以上,アイデアを形にする醍醐味を！【法人営業】◎残業月20～30h程度 正社員,
42,レック・テクノロジー・コンサルティング株式会社 | 完全週休二日制（土日祝休）／残業月平均10h程度／年休125日以上,給与UPを保証★【クラウド・データ分析基盤】★基本フルリモート 正社員,
43,グルーコードテクノロジーズ株式会社 | 【グルーコードグループ】★コロナ禍でも成長／積極採用中,★前給＋α保証 ★年休最大140日 ★多様な働き方【エンジニア】 正社員,
44,株式会社HRアソシエ | 採用代行で大手クライアントの人事をサポート☆人物重視の採用,【採用コンサルタント】未経験からリーダーへキャリアUPも可能！ 正社員,
45,株式会社エージェントゲート | 大手プライム多数/前職最大限保証/定着率94％/年休130日,案件単価の最大75%を還元！月55万～可【インフラエンジニア】 正社員,
46,CLINKS株式会社 | ◆TOKYO働き方改革宣言企業◆テレワーク積極導入◆残業月10～20H,未経験大歓迎！【プログラマー】★社会人デビューの先輩も活躍中 正社員,
47,Modis株式会社 | 旧社名：株式会社VSN,あなたも上流へ【インフラエンジニア】案件の95％が設計構築以上 正社員,
48,サーヴェイトコンサルティング株式会社 | 【経験者は前給考慮】*賞与有*20～30代活躍中*面接1回,【事務系総合職(IT事務/一般事務)】年間休日128日*土日祝休み* 正社員,
49,日本3Dプリンター株式会社 | 平均年齢29歳・土日祝休み・年間休日120日以上,3D技術に携われる！【総合職（営業・マーケティング・技術）】 正社員,
50,"サングローブ株式会社 | ★創業8期目で20,000社と直取引★年休130日/土日祝休み/残業ゼロ",Webマーケティングの【インサイドセールス】未経験で年1000万可 正社員,
51,株式会社インフォプラックス | ◎直近3年の定着率・約90%！◎賞与年2回＋決算賞与(8年連続支給),《経験者優遇》【 SE/PG 】※完全土日祝休み・残業月平均10h以内 正社員,
52,株式会社エージェントゲート | ビッグプロジェクトにも参画！大手プライム多数/前給最大限保証,年収900万～可！数十名以上を管理する規模多数【PM・PMO】 正社員,
53,ヤフー株式会社 | 日本最大級のユーザー数を誇る「Yahoo! JAPAN」,注目度抜群の新事業★服装自由【拠点運営スタッフ】未経験OK 契約社員,
54,株式会社トーガシ | 【安定基盤】イベント業界のリーディングカンパニー/年休120日超,スポーツの魅力を発信し新しいビジネスを創り出す【マーケター】 正社員,
55,株式会社銀座ルノアール | 東証上場★残業少★月8～9日休み★退職金制度など福利厚生充実,"くつろぎとやすらぎを届ける――""ルノアール""の【店舗スタッフ】 正社員",
56,株式会社ビットエー | リモートワーク週3運用/リクルート等大手企業と直取引/住宅手当,チームで稼働【Webディレクター】残業1日平均1H以内 ☆土日祝休 正社員,
57,株式会社ケアリッツ・アンド・パートナーズ | 前職より年収30万円アップ可能／リモート率8割／残業月平均10h,直請75％＆自社サービスでスキルアップできる【SE】★私服OK 正社員,
58,株式会社メイテックフィルダーズ | 【東証一部上場／グループ企業】年収100万UPした先輩も！,【生産技術】より早くより効率的に！モノづくり現場の支え役！ 正社員,
59,株式会社システムリサーチ | 東京システム事業部／東証一部上場◆未経験OK！◆年間休日123日,【総合職（ITエンジニア／営業）】賞与6.3カ月★定着率95%★在宅 正社員,
60,株式会社アクトプロブレインズ | 経験により月給60万以上可*リモートワーク推奨*残業月10h程度,前給保証★年収100万円以上UPの入社実績多数！【ITエンジニア】 正社員,
61,シエルプレザン合同会社 | ◆WEB面接OK（対面は面接1回のみ！）◆リモートワークも可能,前給保証◆二軸の評価基準で強みを活かす【インフラエンジニア】 正社員,
62,コクー株式会社 | 【野村総合研究所・伊藤忠・サントリーなど大手企業と取引】,未経験大歓迎【事務】◆年休124日以上 ◆残業ほぼなし ◆副業OK 正社員,
63,ポスタス株式会社 | パーソルグループ：土日祝休み・年休123日・残業月平均30H以内,モバイルPOSシステム(SaaS)の【営業】※東京/大阪募集・40歳以下 正社員,
64,株式会社リクルートスタッフィング | リクルートグループの正社員として活躍！★在宅ワークも実施中,【人事アシスタント】20代女性活躍中★土日祝休み★残業少なめ 正社員,
65,SCSKサービスウェア株式会社 | 東証一部上場SCSK100％出資 | ★正社員登用実績多数★4月1日入社,【事務スタッフ】★未経験OK/飲食・販売からの転身も★年休123日 契約社員,
66,株式会社メイテック | 東証一部上場／自動運転・EV・航空宇宙などの最先端・先行開発等,【設計エンジニア(自動車/航空機)】40歳平均年収715万/定着率95% 正社員,
67,ヤフー株式会社 | 日本最大級のユーザー数をほこる「Yahoo! JAPAN」,【営業事務】リモートワーク★未経験者歓迎★土日祝休み 契約社員,
68,株式会社ネオキャリア | ◇APマーケティング事業部◇市場規模拡大◇業界大手◇,【提案営業】営業先は無限大★やる気を最重視！20代活躍中 正社員,
69,株式会社スタッフサービス | ＜残業ほぼ無し＞年間休日125日★未経験70％★土日祝休み,在宅勤務が叶う★転勤なし★産育休復帰多数【総務事務】全国募集 正社員,
70,アデコ株式会社 | 【雇用創出・安定化支援事業】フルフレックス／月平均残業20h,企業と人を繋ぐ！人材サービスの【法人営業】☆未経験歓迎 正社員,
71,パーソルテンプスタッフ株式会社 | 大手・優良企業で20代女性活躍中♪定時退社可★土日祝休み,在宅勤務OK【事務スタッフ】事務デビュー◎社会人経験があればOK 正社員,
72,株式会社エージェントゲート | 化粧品、メーカー、ゲームなど大手と取引★土日祝休★副業もOK,【Webデザイナー】★年休130日★全員面談★ 正社員,
73,インターギアソリューション株式会社 | ◎完全リモートワーク！メール納品・全国どこでも勤務可能,【求人広告デザイナー】“採用を実現させる”クリエイティブ 業務委託,
74,株式会社エージェントゲート | 大手プライム多数/前職最大限保証/定着率94％/年休130日,【SE・PG】還元率最大75%！常時1600件！※学歴不問 正社員,
75,株式会社c.paradiso | 残業は月平均0～20時間／年間休日126日／産休・育休あり,未経験者積極採用中！ エンジニアデビューを応援します【SE/PG】 正社員,
76,株式会社メイテックフィルダーズ | 【東証一部上場／グループ企業】最先端開発の豊富な選択肢！,モノとネットを繋ぐ【ITエンジニア(制御・組込系)】未経験歓迎！ 正社員,
77,光ビジネスフォーム株式会社 | ジャスダック上場*テレワーク導入*大手や官公庁と取引*年休126日,上場企業×100％自社内勤務【WEBエンジニア】＊フレックス制 正社員,
78,株式会社アクティアス | 完休2日(年休125日以上)／有給取得率8割以上／残業月平均10H程,＜未経験入社100％＞楽しく働ける明日を♪【初級ITエンジニア】 正社員,
79,株式会社トーガシ | 2022年4月本格スタートの新規事業/年休120日以上/残業月20～30h,withコロナの展示会・イベントを支える【フィールドセールス】 正社員,
80,株式会社Gizumo | 未経験大歓迎/3か月～最長1年の研修/服装・髪型自由♪,【IT系総合職(SE/IT事務)】*93％未経験入社*第二新卒歓迎 正社員,
81,ヤフー株式会社 | ＜ストアアドバイザー＞20代が多数活躍中♪,【広告企画・制作支援】リモートワーク★社会人経験のある方限定 契約社員,
82,株式会社ウィルオブ・ワーク | 東証一部上場グループ企業/残業月平均9.5h/賞与2回/第二新卒歓迎,20代活躍中★土日祝休み★最新サービスを世に広める【法人営業】 正社員,
83,Modis株式会社 | 旧アデコ(株)Modis事業本部◆文系出身者活躍中/産育休取得率100%,【ITサポート】面接満足度90%超★同期50名と学べる1カ月の研修！ 正社員,
84,株式会社フォーラムエンジニアリング | 東証一部上場／エンジニア専門転職サイト「コグナビ」運営会社,未経験から始められる【テストエンジニア】賞与年2回＆土日祝休 正社員,
85,イーコーポレーションドットジェーピー株式会社 | ★受託案件多数★土日祝休★年休125日★残業少,【ITエンジニア】リモート/フレックス可/自社内開発/未経験OK 正社員,
86,H.R.I株式会社 | #ベストベンチャー100 2021受賞 #フリーランスの道も応援♪,最大12ヵ月研修！ゼロから始める【Webデザイナー】★未経験95％ 正社員,
87,株式会社フォーラムエンジニアリング | 東証一部上場／エンジニア専門転職サイト「コグナビ」運営会社,未経験歓迎！【ITエンジニア】◆残業少なめ/賞与年2回/土日祝休 正社員,
88,株式会社フォーラムエンジニアリング | 東証一部上場／エンジニア専門転職サイト「コグナビ」運営会社,未経験歓迎！【ものづくりエンジニア】★土日祝休み＆賞与年2回 正社員,
89,株式会社トーガシ | 2022年4月本格スタートの新規事業/年休120日以上/残業月20～30h,新時代イベントの運営を担う【企画・制作ディレクター】#完休2日 正社員,
90,株式会社ビズリンクス | #完全週休2日制 #土日祝休み #フレックス・時差勤務OK,世の中の働き方を変えていく。【カスタマーサクセス／SV】 正社員,
91,株式会社サーベイジシステム | 東証一部上場企業グループ★年休120日★住宅手当・在宅手当あり,未経験から始める！【ITエンジニア】★安心の研修★Web面接 正社員,
92,株式会社優誠 | 初年度から年収500万円超も可能／2/6(日)転職フェアに参加！,未経験歓迎、イチから指導します!【施工スタッフ】月給25.5万円~ 正社員,
93,ジャパニアス株式会社 | 【本社除く9拠点を展開】◆転勤なし◆年間休日125日◆残業月20H,未経験OK！【ITサポート】★土日祝休★残業月20H★リモート約7割 正社員,
94,株式会社スタッフサービス | <在宅あり>充実のサポート制度♪土日祝休み★賞与あり,初めてのオフィスワークにピッタリ♪【採用アシ】★面接1回★ 正社員,
95,株式会社スタッフサービス | <女性活躍中>プライベート充実の働き方を応援♪在宅勤務も叶う,在宅ありの【貿易事務】基礎から学べる♪だから経験一切不問 正社員,
96,株式会社リクルート | 旅行領域★年間休日145日／完全週休2日制／男性の育休取得実績有,【企画営業(じゃらん)】◎経験者採用◆全国募集◆土日祝休み 正社員,
97,株式会社データホライゾン | 東証マザーズ上場！データヘルス領域で業界シェアトップクラス,自治体向け医療サービスの【提案営業】土日祝休み／リモート可 正社員,
98,株式会社ライズテック | ★女性エンジニアも活躍中！★リモート＆在宅補助あり★土日祝休,経験の浅い方も歓迎！【ITエンジニア】★残業月11.2H★定着率97% 正社員,
99,株式会社トライトキャリア | ★土日祝休み★年間休日120日【大阪府緊急雇用対策に賛同】,人材サービスの【企画営業】★テレワーク実施中★完全週休2日制 正社員,
100,skyny株式会社 | ＃成長率600％のスタートアップ＃年休125日＃社員満足度No1へ！,★育成前提採用★【ITエンジニア】★残業月10H★定着率100％ 正社員,
101,株式会社パルシス | 【創業以来35年黒字】★TOKYO働き方改革宣言企業 ★フレックス制,【ITエンジニア】★フルリモート案件あり ★定着率95％ 正社員,
102,株式会社クレディセゾン | 【東証一部上場】センター設立以来定着率100％／20名の大型採用,CX・EXに貢献し自社事業の魅力創出する【自社プログラマー】 正社員,
103,ヤフー株式会社 | 日本最大級のユーザー数をほこる「Yahoo! JAPAN」,【ストアアドバイザー】リモートワーク★未経験者歓迎★全国募集 契約社員,
104,Modis株式会社 | 旧アデコ(株)Modis事業本部◆帰社日&日報なし/在宅勤務も実施中,中途入社者9割が年収UP/賞与年2回【エンジニア(インフラ/開発)】 正社員,
105,ユナイトアンドグロウ株式会社 | 東証マザーズ上場★『シェアード社員』という新しい働き方を実現,働き方を自分で設計する!【コーポレートエンジニア】定着率9割超 正社員,
106,株式会社スタッフサービス | 在宅あり★服装自由・ネイルOKも選べる★土日祝休み,【事務】ロッテ・サントリーなど、憧れの人気企業で働く♪ 一般派遣,
107,株式会社クオーテック | 完全週休2日制(土日祝)/年間休日126日/月平均残業時間20時間,未経験からはじめる【ITエンジニア】★2カ月の充実研修あり！ 正社員,
108,東京セキスイファミエス株式会社 | 《セキスイハイムグループ》コロナ禍も黒字経営継続の安定企業,未経験歓迎！【リフォームコーディネーター】◎完全週休二日制 正社員,
109,株式会社SHIFT | ◆東証一部上場◆毎年約150％の売上高成長率を継続中◆,【ITエンジニア】未経験スタート96.4％★土日休み・在宅勤務あり 正社員,
110,株式会社アイエスエフネット | ★在宅勤務OK★完全週休2日★平均残業7.8h★インセンMAX60％,月35万～【ITエンジニア】★有給消化81％★受賞歴45個／学歴不問 正社員,
111,株式会社エフオープランニング | ＃35年黒字経営＃転勤なし＃異業種転職が多数＃キャリアパス多彩,【キャリアコーディネーター】未経験OK/志望動機不要/WEB面接可 正社員,
112,グロース・インク株式会社 | 【グロースエクスパートナーズ株式会社100%子会社】,【SE】◆賞与年2回◆年休120日以上◆リモートワーク 正社員,
113,株式会社リクルートスタッフィング | リクルートグループの正社員に♪有名企業で働ける！在宅ワーク有,【貿易事務】20代女性活躍中♪月給制＆賞与年2回★土日祝休み 正社員,
114,株式会社アンスール | 自社内開発やゲーム案件あり★テレワークOK＆残業少なめ♪,やりたいことを本気で実現！【ITエンジニア】★未経験OK 正社員,
115,"株式会社サイバーエージェント | CyberAgent, Inc.　年間休日124日/勤続インセンティブ/月一面談",課題解決のための戦略を創る【広告営業・コンサルタント】 正社員,
116,株式会社リクルートスタッフィング | 大手&有名企業等で理想の働き方を★在宅ワーク実施中/土日祝休み,女性活躍中！【広報・PR業務のアシスタント】★残業少＆休日充実 正社員,
117,株式会社アイエスエフネット | ★在宅勤務OK★受賞歴45個★平均残業7.8h★インセンMAX60％,微経験(入社時)から年276万円UP実績有【ITエンジニア】高卒以上 正社員,
