,会社名,求人タイトル,項目C
710,株式会社GloLing | *残業ほぼナシ *テレワーク導入中 *土日祝休み *産休/育休あり,未経験OK♪ 人と企業を結ぶ【人材コーディネーター】*年休130日~ 正社員,
711,株式会社宙出版 | 年休120日(土日祝休)★YonngLoveComic aya/恋愛白書シェリーKiss,BL・TLコミックの【編集職】～あなたのアイディアでヒット作を！ 正社員,
712,株式会社サンユ情報システム | 土日祝休み・年休121日・残業月平均20時間以内・リモートあり,業界の老舗企業で仲間とともに成長できる！【ITエンジニア】 正社員,
713,株式会社grapple | ◆定時退社 ◆完全週休2日制 ◆土日祝休 ◆年間休日125日以上,【Webディレクター】★未経験の挑戦を歓迎　★20代活躍中！ 正社員,
714,株式会社モアスマイルプロジェクト | 社内に学童保育・病児保育有*在宅・フレックス可*子の看護休暇有,残業ほぼなし！学童保育所の【運営事務】★未経験者歓迎 正社員,
715,吉田電気株式会社 | 充実の職場環境で市場価値の高い経験とスキルを手に入れる,"今よりも""ワンランク""上の働き方を実現！【電気施工管理者】 正社員",
716,サイトカイン株式会社 | Twitter、YouTube、Facebookなど広報にも関われる★経験者優遇！,【Webライター】美容・医療の集客に貢献！取材～SEO対策まで担当 正社員,
717,株式会社セルシス | プロの漫画家やイラストレーター、アニメーターから絶大な支持！,世界1500万ユーザー★グラフィックツールの【Webディレクター】 正社員,
718,株式会社エムティーアンドエス | 年間休日118日＋有給取得平均10～14日＝125日以上！！,【PG・SE】東京・日立・白河募集！◎残業月10時間程度でメリハリ 正社員,
719,株式会社BuySell Technologies | *リユース×Techで成長中 *年休128日 *土日祝 *残業月10h未満,東証マザーズ上場★自社のデジタル広告を彩る【Webデザイナー】 正社員,
720,株式会社徳間書店 | 多彩なWeb媒体を運営！動画やSNSを活用した情報発信にも注力中！,「出版×Web」の未来を切り拓く【Webディレクター】★未経験OK 契約社員,
721,スマカン株式会社 | 【月給31万円以上】☆残業平均20h程度☆有給休暇取得率80％,☆HRTech領域で事業拡大中！IT業界の【人事採用担当】経験者優遇 正社員,
722,株式会社パステムセゾン | 設立22年の安定基盤！大手家電量販店からの信頼が厚い企業★,未経験OK【webデザイナー・コーダー・運用】★リモートOK 正社員,
723,株式会社徳間書店 | メディアミックス作品多数！老舗総合出版社のライツプロデュース,小説や漫画の新たな価値を生み出す【ライツ営業】★未経験OK 契約社員,
724,株式会社アクロクレイン | ユニークな福利厚生もあり、働く環境にも納得！,前職給与考慮！【ITエンジニア】★U・Iターン制度もあり 正社員,
725,株式会社グッドワークス | ◆4年で230％成長◆デジタル社会実現へエンジニア成長機会創出！,取締役ポジション！【管理部長候補（CFO候補）】★月給58.3万~ 正社員,
726,株式会社さかえ経営 | 【業績好調】人事労務のコンサルティング事業を展開,育児ママも活躍中！【事務（給与計算、社会保険関連業務）】 正社員,
727,株式会社 ネットジャパン | ★残業ほぼなし ★駅チカ好立地 ★マイナビから採用実績あり！,道内シェアトップクラス！提案しやすい【ルート営業】未経験歓迎 正社員,
728,株式会社ルーク | 土日祝休★賞与年2回★在宅勤務あり★大阪府緊急雇用対策に賛同,auの法人向けスマホ【ルート営業】年休124日※即戦力採用※ 正社員,
729,株式会社オフィスヨシダ | <不動産業界の大手企業や官公庁と取引>大阪府緊急雇用対策に賛同,未経験から育成【測量スタッフ】※完全週休2日制／残業ほぼ無 正社員,
730,株式会社Shippio | 経済産業省のスタートアップ支援プログラム『J-Startup』企業,"最新の""デジタル化""を実現【オペレーター】★Mgr候補★服装自由 正社員",
731,新日本コーポレーション株式会社 | 景気に左右されない防災関連サービスで未経験でも提案しやすい！,防災設備の【提案営業】★未経験でも月給27万円～ ★土日祝休み 正社員,
732,株式会社テトテ | ■Favori Cloud（ファボリクラウド）■若手活躍中 ■未経験歓迎,ブライダル業界で幅広く活躍できる【お客様サポートスタッフ】 正社員,
733,株式会社ジャパン・テクノ | 日立グループなど大手SIerと直取引＝高い還元率★20～30代活躍中,研修制度や手厚いサポートが自慢！【インフラエンジニア】 正社員,
734,株式会社BuySell Technologies | 東証マザーズ上場★年間休日128日★完全週休2日制★残業月20h程,新規立ち上げ部署のマネージャー！【商品管理部門マネージャー】 正社員,
735,ポスタス株式会社 | 【パーソルグループ】業界No.1のモバイルPOSレジ「POS+」を運営,【営業アシスタント】★フレックス制/残業月20h以下/土日祝休み 契約社員,
736,株式会社ドトールコーヒー | 創業60年／全国約1300店舗展開の業界大手企業／「正社員」採用,ドトールのITシステムを担う【社内SE】※テレワークあり 正社員,
737,興栄商事株式会社 | ◆リサイクル・リユース事業で地球環境に貢献◆4期連続で利益UP,【法人営業】◆年休125日◆残業ほぼナシ◆賞与年3.5ヶ月分以上 正社員,
738,税理士法人NEXPERT | 【NEXPERT GROUP】◆出社時間はフレキシブル ◆選考は1日完結！,【税務会計スタッフ】★在宅勤務OK ★服装＆髪色＆ネイル自由 正社員,
739,MONOLISIX株式会社 | フルリモート/完全週休2日(土日祝)/年休120日以上/残業ほぼなし,【WEBデザイナー】★月給41万円以上 ★マネージャー候補 正社員,
740,朝日税理士法人 | 上場企業の顧問多数／年間休日120日以上／在宅勤務あり！,顧客の実務を効率化・改善する【経理コンサルタント】土日祝休み 正社員,
741,株式会社アドグローブ | 【総合IT企業】月給28万~/残業月平均8.5h/完全週休2日/年休129日,【開発エンジニア】フルリモートOK★大阪限定募集 正社員,
742,株式会社いつも | 【マザーズ上場企業】◇残業月25時間◇プチ休暇あり,多彩なECに挑戦！【ECディレクター】★土日祝休★テレワークOK 正社員,
743,阪急阪神ビルマネジメント株式会社 | 東証一部上場グループ／未経験歓迎！※大阪府緊急雇用対策に賛同,有名施設の運営管理に携わる！【プロパティマネジメント(営業)】 契約社員,
744,株式会社ウィル・インターナショナル | 完全週休2日（土日） #残業少なめ20h程度 #テレワーク実施中,空港に携わる【人材コーディーネーター】経験不問の育成枠採用！ 正社員,
745,日立グローバルライフソリューションズ株式会社 | 日立製作所100％出資,日立家電メンバーズクラブを活性化する【マーケティング企画】 正社員,
746,AJ・Flat株式会社 | 中途入社の80％が年収60万円以上UP ｜社内通貨制度を導入◎,【PG・SE】ちょっとだけ経験者歓迎★前職給110％以上★学歴不問 正社員,
747,株式会社Real Style | 土日祝休・年休120日・賞与3回｜国内TOPクラスのサプリメーカー,＼業務拡大中／【ネットショップ(EC)運営スタッフ】☆経験者採用 正社員,
748,株式会社スマイルビット | 【100％直取引＆自社開発】★残業月平均10h／土日祝休み,【ITエンジニア】として実力をつけ、揺るぎないキャリアと待遇を 契約社員,
749,株式会社会議録研究所 | 安定基盤で長く働いていただけます／テレワークも実施中,未経験からスタートできる！【一般事務・進行ディレクター】 正社員,
750,ライフスタイルカンパニー株式会社 | 土日祝休み・年間休日120日以上・残業月平均20時間以内,自社コスメブランドの【商品企画・ブランドマネージャー】 正社員,
751,株式会社 idea 1tasu | ◆採用戦略の専門家/運用型広告可/月給30万円～残業ほぼナシ,【採用コンサルタント営業】週休３日で働く/求人広告経験者歓迎 正社員,
752,株式会社ナビット | 土日祝休み・年休120日以上・残業月平均20時間以内,乗換アプリやグルメサイト等で表示する店舗情報の【提案営業】 正社員,
753,SCSKサービスウェア株式会社 | 東証一部上場SCSK100％出資 | ◆年休123日◆残業月平均20h以下,【プロジェクト管理スタッフ】★異業種から最短1年で昇格も！ 正社員,
754,株式会社セールドハーツ | 企業のマーケティングや人材育成、DX推進をサポート,【事務】★フルリモートOK★自由な環境で働く★未経験歓迎 正社員,
755,株式会社ナビット | 土日祝休み・年休120日以上・残業月平均20時間程度,多様な企業の成長に貢献する！【提案営業】 正社員,
756,トラスティア株式会社 | 【WEB面接対応OK】リモートで道外企業とのスクラム開発に参加,先進的な開発手法を導入！首都圏に引けを取らない【SE・PG】 正社員,
757,江戸鉄株式会社 | 【歴史ある企業ながらカタくない社風が魅力】＊ボーナス年2回！,【事務スタッフ（工事の計算・図面作成）】★年間休日126日 正社員,
758,ハラダ製茶販売株式会社 | 大正6年創業のハラダ製茶グループ★土日休み★自由度抜群の職場,営業経験が活かせる！【企画営業】*大阪営業所募集 正社員,
759,株式会社アルシード | 【定着率95％】★完全週休2日制(土日)★産育休実績あり★残業10H,将来性の高いIT業界でスキルUP！【ITサポート事務】★年休126日 正社員,
760,株式会社クラウディオデジタルオフィス | バックオフィス業務のBPOサービスを展開,【会計コンサルタント】経理業務を入口にバックオフィスを改善！ 正社員,
761,特許業務法人　あい特許事務所 | 平均勤続年数15年以上/完全土日祝休み/大阪府緊急雇用対策に賛同,【弁理士・特許技術者】◎経験不問/テレワーク可能/年休120日超 正社員,
762,美し信州建設株式会社 | 百年続く、家づくりに取り組む地域密着の工務店／決算賞与支給★,完全自由設計の【住宅設計】※経験者採用/年収650万円以上も可能 正社員,
763,株式会社クリアパートナー | 弁護士とネットワークを築き相続などに伴う不動産売却を支援,【不動産売却支援アドバイザー】◎20・30代活躍中◎土日祝休み 正社員,
764,株式会社オレガ | 鉄鋼製品の専門商社◆自由度高く働き、安定を叶える！,専門商社の【ルート営業】★月給30万円以上★年収1000万円社員も 正社員,
765,ビルボードマネジメント株式会社 | 大手クライアントと直接取引多数/正社員登用実績あり/完休2日,未経験OK！【IT系総合職(カスタマーエンジニア)】#残業月平均20h 契約社員,
766,文化シヤッター株式会社 | 【東証一部上場】リモートワーク実施中／国内TOPクラスシェア有,年休129日★電気・機械系の知識が活きるシャッター等の【開発】 正社員,
767,株式会社インコス | 創業30周年超★前給考慮★残業10ｈ以内、土日祝休み、リモート◎,応募資格を満たす方全員とお会いします！【ITエンジニア】 正社員,
768,Technogram株式会社 | ＜大手～中小まで、業界も多種多様！＞★年収700万円以上も可,制作部門の中心メンバーへ【WEBディレクター】★20代30代活躍中 正社員,
769,クラサポ株式会社 | ★年間休日120日 ★土日祝休み ★リモートOK ★勤務時間自由,【Webデザイナー】スタートメンバー募集★ゼロイチを楽しもう！ 正社員,
770,アサヒオリオン飲料株式会社 | フレックスタイムやテレワーク等、働きやすい体制づくりに注力！,アサヒ飲料グループで安定感抜群【総合職(物流管理)】年休118日 正社員,
771,株式会社クラウディオサステナビリティ | 土日休み・年休120日以上・フレックスタイム制・リモートOK,スタートアップでDXを推進！企業のSDGs支援【コンサル系総合職】 正社員,
772,株式会社KDS | 業績好調により増員募集！官公庁や大手企業と直接取引が強み,【Webデザイナー】月給30万円～/年休120日以上/リモートワーク可 正社員,
773,株式会社グッドウェーブ | 残業少なめ／リモート約8割／年休126日以上／離職率はほぼゼロ！,【SE】★経験者は月給33万円～55万円！案件は自分で決められる！ 正社員,
774,株式会社ピースワン | 東京海上日動 TOP QUALITY代理店／【大阪府緊急雇用対策に賛同】,お客様と親身に向き合える【営業】★健康経営優良法の認定企業 正社員,
775,新家会計事務所 | 試験日休暇有【大阪府緊急雇用対策に賛同】,【税理士アシスタント】★年間休日125日 ★残業月10～15h程度 正社員,
776,サーベイサンプリングジャパン合同会社 | 世界最大級の市場調査会社、米国「Dynata社」の日本法人,"世界が舞台！""市場調査""で課題解決に導く【法人営業】 正社員",
777,株式会社サナス | 【 創業85周年 鹿児島を代表する優良企業 】★4/1までの入社予定,希少な食品素材メーカー【ルート営業】土日祝休/賞与5.35ヶ月分 正社員,
778,株式会社ジスクリエーション | フレックスタイム制◆年休120日以上◆web面接実施◆未経験者歓迎,大切なお客様へ心を込めて送り出す【 ECショップの商品管理 】 正社員,
779,太栄コンサルタンツ株式会社 | 〔 無借金経営・信頼と実績で取引安定 〕＃若手育成枠の募集！,【土木設計】★経験がない方も、実務をイチから教えます！ 正社員,
780,株式会社IN3F | ◎WEB制作・インフルエンサー育成などの領域で成長中◎年休120日,営業・広告運用経験が活かせる【マーケティング/分析】土日休み 正社員,
781,トライアロー株式会社 | 全国8拠点｜設立より黒字経営を継続中｜新生活サポート制度あり,リモート案件多数★【ITエンジニア(システム開発)】※年休127日 正社員,
782,セレンディップ・テクノロジーズ株式会社 | ★賞与昨年度実績4ヶ月分 ★男性の育休実績あり★年休123日以上,リモート業務が約9割！【エンジニア】※経験が浅い方も歓迎 正社員,
783,株式会社ベストワン | 【売上絶好調！自社ECサイトをより魅力に！】＊横浜健康経営認証,売上も働きやすさもTOPクラス！【WEBデザイナー】★残業ほぼゼロ 正社員,
784,株式会社エヌディーヴイ | 年休121日以上・完全週休2日制／映像編集★映像制作プロ集団,映像×デジタルコンテンツを編集する【デザイナー】実務未経験OK 正社員,
785,株式会社フィネス | 転勤なし｜博多駅～徒歩圏内｜営業電話やノルマ、残業なし！,未経験OK【お問い合わせ対応スタッフ】★リモートワーク推進中 正社員,
786,LISUTO株式会社 | 『佐川急便』と資本業務提携を締結★土日祝休み★年休120日以上,＼EC時代にニーズ大／自社サービスの【法人営業】★フルリモート 正社員,
787,スカリー株式会社 | 人気作品多数！CM・ドラマ・映画・MV制作を支える成長企業,急成長中のエンタメ企業をもっと盛り上げる！【人事】★未経験OK 正社員,
788,株式会社ワコー | 【熊本県のSDGs登録企業】社員満足度◎ 40代、50代活躍中！,【総合職(測量/土木設計)】★土日祝休み/年間休日126日/年齢不問 正社員,
789,株式会社ピーアールハウス | ★大手企業・新聞社・出版社と取引★年休約130日/残業月約30h,デジタルはもちろん、紙の経験がある【編集者】 正社員,
790,サーベイサンプリングジャパン合同会社 | 世界最大級の市場調査会社、米国「Dynata社」の日本法人,市場調査の【プロジェクト進行管理】★マネージャ候補採用！ 正社員,
791,スカリー株式会社 | 人気作品多数！CM・ドラマ・映画・MV制作を支える成長企業,次の10年を創る！エンタメの未来を切り拓く【総務】★未経験歓迎 正社員,
792,株式会社センタード | 【業界NO.1のネットコンサルタント会社を目指す成長企業】,データ分析を駆使し市場価値の高い人材へ【Webコンサルタント】 正社員,
793,サミーデジタルセキュリティ株式会社 | ゲーム・パチンコ好き大集合！,【プログラマー】安定企業／土日休み／正社員登用あり 契約社員,
794,株式会社トラストワークス | エンジニアファーストを徹底！経験者が思わず唸る環境があります,【ITエンジニア】月給40万～確約★還元率70%以上★案件選択制★ 正社員,
795,株式会社アンカーリサイクルポート | 今話題のSDGｓ事業を展開／5年間で退職者ゼロの高定着率な職場♪,安定性抜群！【100％反響型のルート営業】★賞与年4.2か月分 正社員,
796,日興ビジネスサポート株式会社 | 完全週休二日／年間休日125日／案件によりフルリモートもOK,【インフラエンジニア】年休125日／テレワーク案件多数 正社員,
797,株式会社リベルタ | 【JASDAQ上場】機能衣料・コスメ・日用雑貨・時計等のメーカー,ライフスタイル製品の【OEM営業】*早期キャリアUP *リモート勤務 正社員,
798,株式会社イトー | <大手企業と取引多数>★コロナ禍でも成長を遂げる専門商社,営業経験を活かす【海外営業】★残業月平均20h以下★土日祝休み 正社員,
799,株式会社セシール | 東証一部上場ノジマグループ|「セシール～♪」のCМでおなじみ！,＼上場グループで新体制を創る／【人事・採用・総務】※土日祝休 正社員,
800,トムラ・ジャパン株式会社 | 一部上場・住友商事グループの基盤／テレワークあり／年休124日,安定企業でキャリアアップ！【社内SE】★残業月10h以下/土日祝休 正社員,
801,アクア急便株式会社 | 年間休日115日｜大阪府緊急雇用対策に賛同,未経験で月給25万円～！アクアクララの【ルート配達ドライバー】 正社員,
802,株式会社フィネス | 博多駅から徒歩圏内｜基本残業なし｜女性管理職の割合は38％,【 経理事務 】★必須：経理業務の経験★基本残業なし！ 正社員,
803,株式会社レクストカスタマーサービス | 【2017年設立のベンチャー企業】■フルリモートOK■未経験歓迎,新規事業の【コールセンタースタッフ】■年休123日■残業ほぼ0 正社員,
804,エコスタッフ・ジャパン株式会社 | 官公庁からの依頼も多数★プライベートと仕事を両立,【事務局スタッフ】未経験歓迎★リモートワーク可！ 正社員,
805,株式会社フロントステージ | 【クライアント企業の真のパートナーに】★意欲重視の採用,企業の想い・サービスを世の中に届ける！【広報・PR】未経験OK★ 正社員,
806,株式会社テクノジャパン | ★完全週休2日制 ★残業月10H程度 ★月給25～40万円＋賞与年2回,建設資材の【企画・設計アシスタント】★未経験OK ★土日祝休 正社員,
807,トムラ・ジャパン株式会社 | 一部上場・住友商事グループの基盤/残業月平均15～20h！,未経験歓迎！育成枠採用【メンテナンススタッフ】★年休124日 正社員,
808,コムスイート株式会社 | 次代のソフトウェアを扱う総合IT企業/大阪府緊急雇用対策に賛同,【ITエンジニア】完全週休2日/初年有休15日/賞与4ヶ月＋決算賞与 正社員,
809,株式会社リアクティブデザイン | リモートワーク導入 | Mac book貸与 | 大阪府緊急雇用対策に賛同,【総合職（Webコーダー・デザイナー）】■年休129日■残業少なめ 正社員,
810,株式会社アイ・ディー・エー | 発注者支援（官公庁）/NEXCO、道路、河川、砂防、ダム、水路等,【技術職（土木・電気・機械）】施工管理、発注者支援（官公庁） 契約社員,
811,CURSOR株式会社 | 年間休日120日以上 ◆ 完全週休二日制(土日祝) ◆ 残業月平均8H,有名ゲーム・アニメの【3DCGデザイナー】★月給30万円以上 正社員,
812,株式会社グローバルエームズ | 販売台数年々増加の安定企業 ☆年休120日以上 ☆完全週休2日制,美容機器メーカーの【営業】☆土日祝休み☆リモートOK 正社員,
813,株式会社DEGICA | ★土日祝休み ★年休128日 ★基本残業なし ★フレックスタイム制,グローバル企業で英語を活かして活躍！【人事・労務スタッフ】 正社員,
814,株式会社4COLORS | [経常利益30%・黒字経営]完休2日／年休120日以上／ 残業ほぼナシ,【経理】★コーポレート部門スターティングメンバ―として活躍 正社員,
815,株式会社リベルタ | 【JASDAQ上場】コスメ・日用雑貨・機能衣料・時計等のメーカー,ブランディングにも携われる【PRスタッフ】★土日祝休み 正社員,
816,株式会社中央書店 | 《コミコミスタジオ》★基本リモートワーク★残業月10時間程度,BLコミック販売・グッズ等の【クリエイティブ系総合職】 正社員,
817,株式会社セシール | 東証一部上場ノジマグループ|「セシール～♪」のCМでおなじみ！,＼新たなヒットを仕掛ける／【販促企画・広告運用】※土日祝休 正社員,
818,株式会社リベルタ | ＜JASDAQ上場＞★「Baby Foot」など自社製品多数 ★土日祝休み,自社オリジナルの日用雑貨を扱う【企画・提案営業】★未経験OK 正社員,
819,レック株式会社 | 【東証一部上場】「激落ちくん」や「バルサン」など人気商品多数,ベビー＆キッズ向け日用品の【商品企画】★土日祝休み 正社員,
820,株式会社ビジョンセンシング | 赤外線カメラ・画像処理システムなど設計・開発企業！,宇宙・防衛分野に関わる【FPGA設計】★20～40代活躍中！ 正社員,
821,三和電子株式会社 | テレワーク対応中・土日祝休み・年休126日・残業月平均30ｈ以内,東証一部上場グループで経験を活かす【ソフトウェアエンジニア】 正社員,
822,長州産業株式会社 | 北陸営業所／TVCMで知名度抜群／コロナ禍でも黒字経営／土日祝休,《金沢限定募集》優良メーカーの【法人営業】★賞与4.2ヵ月分 正社員,
823,ヤマガタヤ産業株式会社 | <建築資材総合商社> ★地域に根付いて長期的なキャリアを！,既存顧客への【 ルート営業 】★賞与年3回 ★業界経験不問 正社員,
824,株式会社グレープシステム | 完全週休二日制（土日祝休）／残業月平均10h程度／年休128日,社内のデジタル化を企画段階から推進する【社内SE】フレックス有 正社員,
825,新橋製紙株式会社 | ≪1948年創業の製紙メーカー≫ 次世代の管理職候補募集！,東京～神奈川エリア担当【企画営業職】※フルリモート勤務 正社員,
826,株式会社メガ・テクノロジー | ◆即戦力採用◆土日祝休◆残業月15H未満◆リモート推進中,【IT技術者】PM／情シス支援／SE★40代～60代活躍中！ 正社員,
827,株式会社TERASS | 完全自由なフルリモート/売上75％が収入/未経験者のサポート体制,業界未経験＆副業OK【不動産売買仲介エージェント】面接1回！ 業務委託,
828,株式会社ユニアワークス | 17期連続売上UP★残業少★完全週休2日(土日休み)★テレワーク有,＼大手企業グループで活躍／【事務スタッフ】★年休120日以上 正社員,
