,会社名,求人タイトル,項目C
948,株式会社Bewin | 【福岡営業所限定採用】求人サービス『じょぶる』の会社です！,福岡の企業が抱える”人材”に関する課題を解決！【 法人営業 】 正社員,
949,株式会社プロセルトラクション | 【第二の創業で積極採用】★業界未経験可★リモートワーク実施中,大手企業の新規事業立ち上げを支援する【企画営業】年休123日 正社員,
950,株式会社コムデック | 【県内随一の働き方改革DX支援企業】賞与5.7ヶ月分＊津駅徒歩7分,IT業界に転職しよう!【ITエンジニア】 ※津駅近くで通いやすい◎ 正社員,
951,医療法人祐涼会 | 神谷デンタルオフィス／藤沢駅徒歩3分♪週休3日の週があります！,年間休日140日以上！クリニックを支える 【受付・事務スタッフ】 正社員,
952,ノーザリーメディカル株式会社 | 【設立から9年連続売上UP】★平均年齢約30歳 ★残業月平均10h程,睡眠でお悩みの患者さまをサポートするやりがい◎【提案営業】 正社員,
953,特定非営利活動法人アイ・エス・エル | 学校法人至善館の母体/年間休日130日以上でメリハリのある働き方,★成長できる職場で働きたい方歓迎！【企画・運営スタッフ】 正社員,
954,ヴィーエー・リナックス・システムズ・ジャパン株式会社 | ★SCSK100％子会社★在宅勤務も可★年収1200万円も目指せる！,【IT総合職（開発エンジニア／カーネルエンジニア）】★残業なし 正社員,
955,株式会社セキサン | 外回りはほとんどなし！デスクワークが中心◎20～30代活躍中,＼未経験歓迎／【積算技術者】◎在宅勤務OK ◎年休130日以上 正社員,
956,株式会社ピコ・イノベート | 仕組みからデザインするプロ集団、こだわりのデザインを形に！,【空間デザイナー】企画・デザイン・施工監理＜海外案件進行中＞ 正社員,
957,株式会社セイバン | 創業100年以上！老舗ランドセルメーカー◆充実の福利厚生完備,天使のはねランドセルの【開発設計】残業月平均10h／賞与年2回 正社員,
958,株式会社フロンティア | #完全土日祝休 #年休126日 #残業月平均10.5h #WEB面接対応可,【総合職(WEBディレクター/WEBデザイナー)】有給100％消化を推奨 正社員,
959,東京ラヂエーター製造株式会社 | 東証二部上場／設立83年／自動車部品メーカー,I・Uターン歓迎！神奈川勤務【購買/資材調達】※転勤なし 正社員,
960,合同会社ARQS | ◎テレワーク可 ◎年間休日120日以上 ◎残業ほぼゼロ ◎転勤なし,スターティングメンバ―として活躍可能！【Webデザイナー】 正社員,
961,株式会社京都嵯峨野 | 広島ブライダル館／HIROSHIMA WEDDING'sグループ／広島市内のみ,年休115日以上☆業界屈指の好環境【ブライダル総合職】転勤なし 正社員,
962,株式会社クラウドスミス | ★社員定着率100％★毎期150％超成長★スピード昇給,【WEB系エンジニア（SE、PG)】◆PL/PM候補◆経験者前給考慮 正社員,
963,TAOCC株式会社 | 企業向けに不動産ビジネスを展開する成長企業！★完全土日休み,≪最大限前給考慮≫ 法人用不動産の【仲介営業】★テレワークOK 正社員,
964,株式会社エム・ソフト | ★誰もが知る大手企業と取引多数 ★東証一部上場キヤノン出資,【開発エンジニア】★土日祝休み ★残業月平均15.5h ※未経験OK 正社員,
965,株式会社シェアードリサーチ | 上場企業300社にIR支援サービスを提供するリサーチカンパニー,【人事(採用)】☆繁忙期以外は毎日定時退社☆リモートワーク推進 正社員,
966,株式会社Dfor | ＼ 三重の会社だけど、どこでも働ける完全リモートOK！／,"""大手企業のレア案件"" などを任される【SE/PG】＊年休120日以上 正社員",
967,株式会社創通メディカル | 昨年売上比600％↑自社ブランド商品を持つメーカー★残業月20h↓,商品ブランディングに携わる【デザイン企画～制作・進行】 正社員,
968,ハートコア株式会社 | 国内売上No.1（※）の実績を誇るCMSパッケージ「HeartCore CMS」,【カスタマーサポートスタッフ】★完全週休2日制★未経験歓迎 正社員,
969,公益財団法人川崎市産業振興財団 | 《中小企業の経営支援などを行う財団法人》★60代も活躍中,海外ビジネス経験活かす【コーディネーター】※週4勤務&残業なし 契約社員,
970,京セラ株式会社 | 【東証一部上場】残業少なめ／年休127日／リモートワーク推進中,京セラで働く【事務スタッフ】(京都・東京・仙台) ★賞与5.3ヶ月 正社員,
971,株式会社STANDARTH | ★完全土日祝休み★年間休日120日【大阪府緊急雇用対策に賛同】,【総合職(ECサイト運営/店舗スタッフ(店長候補)】★経験者歓迎！ 正社員,
972,株式会社ＦＣサービス | 《 期末手当を4ヵ月毎に支給 》★40・50代活躍中！,アイス等を届ける【 倉庫管理スタッフ 】＊夜勤なし／年齢不問 正社員,
973,有限会社ル・レヴェイユ | 大手と取引多数！★在宅勤務も実施中★基本土日休み,マンションなどの間取り図 制作の【進行管理】★未経験歓迎！ 正社員,
974,太啓建設株式会社 | ＼表彰や資格取得で金一封？！／ ◎未経験歓迎！◎年間122日休み,創業95年＊街をつくるお仕事の【 手配・管理スタッフ 】手当充実 正社員,
975,株式会社ウィザード | VOGUEやELLEなどファッション系の実績多数★英語が活かせる環境,モデルが輝く場所をプロデュース♪【マネージャー】土日祝休み 正社員,
976,株式会社システムプレイズ | 土日祝の完全週休2日｜年間休日120日以上｜残業少なめ,SEへのステップアップを応援！経験が浅い方も歓迎の【PG・SE】 正社員,
977,株式会社オーダス | ★コスメ好き、旅好き、おいしいもの好きに最適♪ ★完休2日制,化粧品メーカーのPR業務をサポートする【プレス】★未経験OK 正社員,
978,エレコムサポート＆サービス株式会社 | プライベートと両立できる会社！8割が未経験！札幌駅チカ！,正社員登用あり！【問合せ対応】年休124日★在宅可★未経験OK！ 契約社員,
979,株式会社光機械製作所 | 【マイナビ転職初掲載！】世界に技術を発信する三重の優良企業,三重【機械設計】専用機/工作機械/構想設計～詳細設計/土日休 正社員,
980,トーホー加工株式会社 | コロナ禍でも安定企業！創業100余年、大手企業と多数取引あり。,食品パッケージメーカーの【営業事務】★未経験歓迎★駅チカ♪ 正社員,
981,ランスタッド株式会社 | DR事業部★日本全国に92拠点を構える大手総合人材サービス会社,【人材コンサルタント営業】外資系企業！未経験OK／リモート有 正社員,
982,株式会社イメディア | 賞与は平均216万円の実績！高還元率のエンジニアのための会社！,【SE・PG】★業界高水準の給与還元率！やりたい案件を自由に選択 正社員,
983,株式会社アイテム | 【大阪府緊急雇用対策に賛同】希望しない転勤ナシ！福利厚生充実,創業30年以上の成長企業！仲間の業務を支える【システム管理者】 正社員,
984,コーデソリューション株式会社 | 大阪府緊急雇用対策に賛同／残業月平均20h以内／在宅勤務中心,【SE/PG】業界シェアトップクラスの自社パッケージ開発 正社員,
985,株式会社セイコウアートグレス | 未来の通信インフラを創りだす！安定性抜群◎【面接1回で内定】,携帯基地局の【設置・メンテナンス】土日祝休み！年休120日以上 正社員,
986,クリエイトソリューションズ株式会社 | 《7期連続売上UP》日立グループなど大手との直取引の実績！,【一般事務】完全週休二日制で有給取得率90%！20代中心に活躍中 正社員,
987,株式会社リマト | 土日祝休み・年休122日・残業月平均10H以内・産育休制度あり,ワークライフバランスを両立して活躍する【事務】★未経験歓迎★ 正社員,
988,ニューライフ横浜株式会社 | 【神奈川トヨタ自動車（株式会社KTグループ）の提携会社】,家庭や子育てとの両立OK♪【ライフアドバイザー】★基本定時退社 正社員,
989,株式会社コム計画室 | 女性活躍中/年休120以上/表参道駅チカ/経験&アイデアを活かせる,"生活用品の""売れる""誌面づくりの【販促企画・編集制作】締切間近 正社員",
990,株式会社 中央事務所,【コールセンタースタッフ】★週4日勤務から可能　★大阪駅チカ 契約社員,
991,株式会社 中央事務所,【コールセンタースタッフ】★週4日勤務から可能　★新宿駅チカ 契約社員,
992,株式会社メドレー | 東証マザーズ上場/土日祝休/産休育休実績多数/服装・ネイル自由,【総合職(キャリアサポート・キャリアサポートアシスタント)】 契約社員,
993,マルチコンピューティング株式会社 | 【WEB面接可】働きやすさ抜群◎年休120日！定着率「8割超」！,【SE】★自社内開発&上流工程メイン！★リモートワーク実施中！ 正社員,
994,株式会社コンピュータウイング | 年休125日 文教系システムを開発・販売するソフトウェアメーカー,☆若手積極採用☆自社製品の【運用サポート】※未経験可 正社員,
995,株式会社かみゆ | 産休育休の取得実績あり／20代が活躍中／転勤なし♪,【書籍・雑誌編集】◎歴史関連の媒体中心◎女性活躍中◎未経験OK 正社員,
996,株式会社ブラン・クリエイト | アニメなどの有名大型イベント／大手企業案件など実績多数！,未経験から学べる！ステージや舞台の【演出・進行ディレクター】 正社員,
997,THI Japan株式会社 | 世界に81拠点を持つT3EXと東証一部上場センコーGHDの合弁会社,【総合職(輸出入業務、営業)】 ★週1リモートワーク勤務制度有 正社員,
998,株式会社Bewin | ★広島営業所のオープンに伴う、スターティング募集★転勤なし,基本はリモートワーク！自社求人広告「じょぶる」の【法人営業】 正社員,
999,株式会社コンフィデンス | 東証マザーズ上場|キャラクターコンテンツのSNS運用にも携われる,ゲームクリエイターの未来を描く【Webデザイナー】★本社勤務！ 正社員,
1000,有限会社ユニット・エムエスイー | ≪ 週休3日制 × 17時退社 ≫ ★最先端の働き方を選べます！,働き方が選べる【営業職】#未経験OK #副業可 #週休3日制 正社員,
1001,株式会社アトリエ・ジオ | ★完全週休2日（土日祝休）★年間休日125日 ★残業月平均10H程度,幅広いジャンルの建物をデザインする【注文建築の設計スタッフ】 正社員,
1002,税理士法人ヴェンティ | 賞与・昇給年2回／中小から大手企業まで多数の取引実績あり,【税理士補助】資格不問！税務や財務のプロを目指せる！ 正社員,
1003,フレスコ株式会社 | ☆健康や、美容に特化したEC事業を展開 ☆前職の給与を考慮,【Webエンジニア】*土日祝休 *月2万昇給実績有 *フルリモート可 正社員,
1004,株式会社DLCネクスト | ■年休125日■テレワーク実施中■残業ほぼ無し■早期入社歓迎,【ITエンジニア】★前職給与保証 ★年収700万円以上可 ★面接1回 正社員,
1005,株式会社西尾産業 | 元請8割で業績好調｜完全週休2日(2022年度より)｜年間休日122日,【企業広報・営業企画】働き方改革により働きやすさも抜群♪ 正社員,
1006,Ｉｎ．Ｔｅ株式会社 | 【面接1回】制御・基幹システム開発・システム構築を手掛ける,7年連続で売上UP！【インフラエンジニア】年間休日129日！ 正社員,
1007,メディア株式会社 | 歯科医療IT分野のリーディングカンパニー,歯科医療のIT化を支える【社内インフラエンジニア】★経験者募集 正社員,
1008,株式会社ExPlay | <仙台勤務>■東証1部上場のグリーグループ■WEB面接可■転勤なし,心が動く体験をデザインする【CS部門のマネージャー候補】 正社員,
1009,株式会社マイナビ | 就職や転職などのあらゆる人生の岐路を支えるサービスを提供,【Webアプリケーションエンジニア】大規模サービスに携わる！ 正社員,
1010,ポーターズ株式会社 | 【設立20年】★年間休日127日★土日祝休み★残業1日平均1ｈ程度,経験を活かす！【マーケティングマネージャー】★業界未経験OK 正社員,
1011,株式会社日本ビジネスプレス | ◎お客様と一緒にサイトを育てるやりがい◎リモートワーク推奨,【フロントエンジニア】★完週休2日★年休119日★賞与4ヵ月 正社員,
1012,株式会社バーチャルユニバーシティ | 【IT×教育】個人＆法人受講者向けにITスクールを運営中！,【ITスクール講師（UnrealEngine担当）】★年休125日★WEB面接OK 正社員,
1013,株式会社フォノグラム | 年間休日120日｜在宅・リモートワークOK｜残業月平均20~30時間,Web制作の【フロントエンドエンジニア】※有名企業の案件多数 正社員,
1014,株式会社西尾産業 | 元請8割で業績好調｜完全週休2日(2022年度より)｜年間休日122日,【建築施工管理補助】資格がなくても月給34万円以上の高待遇！ 正社員,
1015,テレビ静岡システムクリエイツ株式会社 | 【社員定着率90%超】賞与6ヶ月分/残業月20h以下/年休120日以上,自社開発システムの【法人営業】※経験者募集 正社員,
1016,メディア株式会社 | 創業40年／歯科医療IT分野のリーディングカンパニー,【社内SE】※マネージャー候補　★経験者募集 正社員,
1017,株式会社バーチャルユニバーシティ | 【IT×教育】個人＆法人受講者向けにITスクールを運営中！,【ITスクール講師（RPA担当）】★年間休日125日★WEB面接OK 正社員,
1018,Ｉｎ．Ｔｅ株式会社 | 【面接1回】制御・基幹システム開発・システム構築を手掛ける,7年連続で売上UP！【組込エンジニア】☆年間休日129日！ 正社員,
1019,株式会社セブントゥワン | 製薬業界に特化したコンサルティング会社◆恵比寿駅チカ勤務♪,【事務スタッフ】（製薬／市販後調査／医療事務）★未経験者歓迎 契約社員,
1020,株式会社GSI | 仙台支社限定★転勤無★定着率92％★広瀬通駅徒歩1分★平均30歳,2021年Openの新拠点で働く！【エンジニア】年間休日128日★ 正社員,
1021,株式会社パーク | ★自社内開発が約5割★フレックスタイム制★完全週休二日制,最先端システムを開発し日本を支える【ITエンジニア】残業少なめ 正社員,
1022,株式会社西尾産業 | 元請8割で業績好調｜完全週休2日(2022年度より)｜年間休日122日,【事務スタッフ】働き方改革により働きやすさも抜群♪ 正社員,
1023,株式会社マイナビ | 就職や転職などのあらゆる人生の岐路を支えるサービスを提供,【インフラエンジニア（クラウド／AWS）】自社サービスに携わる 正社員,
1024,株式会社マイナビ | 就職や転職などのあらゆる人生の岐路を支えるサービスを提供,【Webマーケティング】マイナビ・グループ企業のDX推進 正社員,
1025,株式会社マイナビ | 就職や転職などのあらゆる人生の岐路を支えるサービスを提供,マイナビ転職の【広告営業】★千葉エリア積極採用中 正社員,
1026,株式会社テクノプロ | テクノプロ・エンジニアリング社◇2/27(日)転職フェア仙台に出展,【ITエンジニア(アプリ開発・インフラ保守運用)】★未経験歓迎 正社員,
1027,Ｉｎ．Ｔｅ株式会社 | 【面接1回】制御・基幹システム開発・システム構築を手掛ける,7年連続で売上UP！【システムエンジニア】☆年間休日129日！ 正社員,
1028,ネオス株式会社 | 大手案件多数！世の中にインパクトを与える大規模サービスに関与,オフショア開発における【ブリッジSE】★札幌勤務・完全週休2日 正社員,
1029,株式会社マイナビ | 就職や転職などのあらゆる人生の岐路を支えるサービスを提供,マイナビ転職の【広告営業】★九州エリア積極採用中 正社員,
1030,株式会社ビヨンドボーダーズ | 【”不動産×IT×海外ビジネス”で急成長！】★フルリモート可能,【キャリアパートナー】★2期目の新事業部で活躍★第二新卒歓迎 正社員,
1031,三菱重工エンジンシステム株式会社 | 【三菱重工グループ】◆完全週休2日制 ◆残業月20時間程度,三菱重工グループの【経理】◆リモートワークOK◆年間休日125日 契約社員,
1032,株式会社エムテック | 3/7(月)～3/12（日）マイナビ転職フェアONLINEに出展します♪,前給保証！在宅ワーク実施中★【ITエンジニア】◎未経験OK！ 正社員,
1033,佐久間特殊鋼株式会社 | ◎賞与5か月分◎リモートワーク導入,名古屋勤務／【営業職】大手自動車部品メーカーへの提案営業 正社員,
1034,スタジオアンビルト株式会社 | 建築の新しいワークスタイルを創造する会社◆リモートワーク可能,《名古屋市勤務》【VPoB（プロジェクトの責任者）】完全土日休み 正社員,
1035,ドコドア株式会社 | 必要なのはPCだけ。あなたのいる場所がオフィスに。,【カスタマーサクセス】完全週休2日制（土日祝）★経験者歓迎 正社員,
1036,佐久間特殊鋼株式会社 | ◎賞与5か月分　◎年休115日　◎リモートワーク相談可,茨城勤務限定募集【営業職】大手自動車部品メーカーへの提案営業 正社員,
1037,株式会社 エンファクトリー | EC・メディア・人材育成事業を運営！,プロを活用した事業推進支援サービスの【提案営業】 正社員,
1038,スタジオアンビルト株式会社 | 建築の新しいワークスタイルを創造する会社◆リモートワーク可能,《名古屋市勤務》【法人営業】※完全土日休み・年間休日127日 正社員,
1039,日本コンピュータ・ダイナミクス株式会社 | ☆有休消化率全国6位*（福利厚生の充実度も業界随一！）,JASDAQ上場企業で更なる活躍を！【アプリケーションエンジニア】 正社員,
1040,日本綜合建設株式会社 | 2月19日（土）転職フェア長野に出展いたします！,社会インフラに携わる【営業】年休128日◎転勤無し◎定着率抜群 正社員,
1041,株式会社ジェイ・クリエイト | フレックスタイム制／完全週休2日(土日)／年間休日121日,【 ITエンジニア(PG/SE) 】★自社内開発あり/テレワーク導入済み 正社員,
1042,利島建設株式会社 | ★完週2日（土日休み）★転勤なし★基本残業なし ★手当充実,離島のくらしをつくる【施工管理】★未経験歓迎★月給24万円～ 正社員,
1043,日本コンピュータ・ダイナミクス株式会社 | ☆有休消化率全国6位*（福利厚生の充実度も業界随一！）,JASDAQ上場企業で更なる活躍を！【マーケティング（IT事業）】 正社員,
1044,スタジオアンビルト株式会社 | 建築の新しいワークスタイルを創造する会社◆リモートワーク可能,《東京勤務》【法人営業】※完全土日休み・年間休日127日 正社員,
1045,株式会社Bwave | 資格手当・皆勤手当など充実♪リモートワーク実施中◎経験者優遇,【インフラエンジニア】＊残業ほぼなし＊在宅勤務OK＊若手活躍中 正社員,
1046,株式会社エクシーズ | 福岡の独立系SIer！業務システムの企画・提案から開発・保守まで,【システムエンジニア／プログラマー】★フレックス・在宅可 正社員,
1047,日本コンピュータ・ダイナミクス株式会社 | ☆有休消化率全国6位*（福利厚生の充実度も業界随一！）,JASDAQ上場企業で新たなキャリアを！【オペレーション業務SE】 正社員,
1048,株式会社FALCONER | 楽天でも人気◎キャリアチェンジ歓迎◎成長中企業でスキルアップ,【EC運営・マーケティング担当】EC店舗ディレクション・デザイン 正社員,
1049,スタジオアンビルト株式会社 | 建築の新しいワークスタイルを創造する会社◆リモートワーク可能,《名古屋市勤務》【家づくりコンサルタント】※完全土日休み 正社員,
1050,株式会社アルプス技研 | 名古屋営業所【東証一部上場】2/26(土)マイナビフェア名古屋出展,【技術系総合職（機械/電気/ソフト/化学）】★中日本エリア募集 正社員,
1051,朝日インタラクティブ株式会社 | 【朝日新聞グループ】★社会的影響力の大きい案件に携われる！,IT専門媒介「ZDNet Japan」の【編集職】★年間休日120日以上 正社員,
1052,スタジオアンビルト株式会社 | 建築の新しいワークスタイルを創造する会社◆リモートワーク可能,《東京｜転勤なし》【CTO（最高技術責任者）候補】※年休127日 正社員,
1053,スタジオアンビルト株式会社 | 建築の新しいワークスタイルを創造する会社◆リモートワーク可能,《名古屋｜転勤なし》【フロントエンドエンジニア】※年休127日 正社員,
1054,株式会社トライング | 転職支援を中心にWeb制作やSNSマーケティング事業を幅広く展開,【デジタルコンサルティング営業】土日祝休／年間休日120日以上 正社員,
1055,スタジオアンビルト株式会社 | 建築の新しいワークスタイルを創造する会社◆リモートワーク可能,《東京｜転勤なし》【機械学習エンジニア】※年間休日127日 正社員,
1056,佐久間特殊鋼株式会社 | ◎賞与5か月分◎リモートワーク導入,名古屋勤務／【品質保証】自動車部品メーカー向け品質対応 正社員,
1057,有限会社アイデジタル | ◎34歳で年収694万円の実績あり！月8日休み(土日OK)/残業ほぼ0,【販売スタッフ】未経験で高収入を目指せる◆男女問わず活躍中★ 正社員,
1058,株式会社ハイクラウド | 3/7～3/12 マイナビ転職フェアオンライン参加決定！★年休126日,【ウェブアプリ開発】プログラマからチームリーダまで幅広く募集 正社員,
1059,株式会社テレビ朝日メディアプレックス | テレビ朝日グループ◆在宅勤務OK◆フレックス勤務,安定基盤で活躍！【PM候補／Webアプリケーションエンジニア】 正社員,
1060,スタジオアンビルト株式会社 | 建築の新しいワークスタイルを創造する会社◆リモートワーク可能,《東京｜転勤なし》【フロントエンドエンジニア】※年休127日 正社員,
1061,ビートテック株式会社 | 「エンジニアファースト」を掲げる設立7年目のフレッシュな企業,IT企業とエンジニアをつなぐ【SES営業】※大阪募集★土日祝休み 正社員,
1062,株式会社エクシーズ | 福岡の独立系SIer！業務システムの企画・提案から開発・保守まで,【プロジェクトマネージャー／エンジニア】★フレックス・在宅可 正社員,
1063,スタジオアンビルト株式会社 | 建築の新しいワークスタイルを創造する会社◆リモートワーク可能,《東京勤務》【VPoB（プロジェクトの責任者）】※完全土日休み 正社員,
1064,スタジオアンビルト株式会社 | 建築の新しいワークスタイルを創造する会社◆リモートワーク可能,《名古屋｜転勤なし》【CTO（最高技術責任者）候補】※年休127日 正社員,
1065,株式会社サンゲツ | ◎東証・名証一部上場　◎インテリア専門商社　◎福利厚生充実,《東京｜品川》上場企業で活躍できる【社内SE】※経験者対象 正社員,
