,会社名,求人タイトル,項目C
352,株式会社クオリア・リンクス | ＼残業月平均10h以下／「ITって何の略？」レベルでもOK♪,定期昇給/手当業界最高水準♪【IT事務・エンジニア】*未経験優遇 正社員,
353,株式会社キャライフ | ★稼ぎたい派・オフ重視派どちらも歓迎 ★1年で昇給200万の例も,【キャリアアドバイザー】★年間休日120日以上 ★土日祝休み 正社員,
354,株式会社NPCコーポレーション | 月給50万円以上可/テレワーク実施【大阪府緊急雇用対策に賛同】,印刷・広告・WEB・動画などの【企画営業】※完全週休2日制 正社員,
355,株式会社セシール | 東証一部上場ノジマグループ|「セシール～♪」のCМでおなじみ！,その手でヒット商品を！レディース・メンズアウター等の【MD】 正社員,
356,株式会社リクルートスタッフィング | リクルートグループの限定正社員に！★年休125日★在宅ワーク有,【プロジェクトマネージャー】月29万～☆土日祝休み★フレックス 正社員,
357,株式会社古田土経営 | ★仕事も家庭も両立！柔軟な就業環境をがある働きやすい環境！,組織づくりを担う【採用担当】★年間休日125日／残業なし！ 正社員,
358,大同生命保険株式会社 | 業界トップクラスの実績と信頼 ★土日祝休み ★福利厚生充実,業界経験不問【代理店支援営業】※営業経験2年以上の方限定 正社員,
359,池上産業株式会社 | 【1889年創業の安定基盤】【リモートワーク実施中です】,取引先へ木材製品を提案！【営業】◎年間休日120日以上 正社員,
360,グラフィソフトジャパン株式会社 | <世界100ヵ国超に展開するBIMソフトメーカー> ★年休120日以上,自社BIMソフトの【プロダクトマネジメント】★ほぼフルリモート 正社員,
361,北斗株式会社 | ★完全週休2日(土日祝休み) ★残業月20時間以内 ★在宅勤務OK,【人材コーディネーター】★未経験・第二新卒歓迎 ★賞与年3回 正社員,
362,NAVEEY株式会社 | ■初年度年収550万円以上も可 ■リモート・時短の相談もOK,お喋り好きのSE・PGにオススメしたい【システム営業】■土日祝休 正社員,
363,國際株式会社 | 《 安定基盤の國際グループ！ 》◆残業月30時間以内,若手活躍中！完休2日【事務系総合職(経理・財務・総務・人事)】 正社員,
364,株式会社ジェーシービー | 誰もが知る日本発の国際カードブランド,【QAエンジニア】※完全週休2日制/福利厚生充実 正社員,
365,株式会社 NTTデータ | 専業システムインテグレーターとして”2兆円”を超える売上高,【インフラ系エンジニア職(PM/ネットワーク/サーバー等)】 正社員,
366,伊藤忠テクノソリューションズ株式会社 | (CTC),【ソリューション営業】 正社員,
367,株式会社大崎コンピュータエンヂニアリング | ◆創業68年の老舗 ◆個人ノルマなし ◆土日祝休み ◆若手活躍中,千葉・東京を中心にDXで顧客の情報通信・IT環境を支援【営業】 正社員,
368,ウメトク株式会社 | 土日祝休み・年間休日120日以上,特殊鋼の老舗専門商社で活躍する！【ルート営業】★未経験歓迎★ 正社員,
369,ジャパンレントオール株式会社 | 「SUMMER SONIC」「ULTRA JAPAN」など大型イベントの実績多数！,【総合職(イベント企画提案・設営／新規事業推進)】※未経験OK 正社員,
370,株式会社ネオキャリア | 【APマーケティング事業部】年休124日◆手当充実◆平均年齢26歳,【求人広告の制作・進行管理】在宅勤務あり!!20~30代活躍中◆ 正社員,
371,株式会社ジーニアス・ブレイン | 【日本NLP協会／NLP-JAPANラーニング・センター】,【WEB制作＆デザイナー】★自社サイトの企画制作から運用まで 正社員,
372,株式会社Special Medico | 土日祝休み・年間休日127日・原則定時退社,★未経験でもOK★ 医療×テクノロジー分野の【PR・広報】 正社員,
373,東芝情報システム株式会社 | 年休127日／平均勤続年数23.6年／定着率・働きやすさ◎,【組込みシステムエンジニア】フレックス&リモート※未経験歓迎 正社員,
374,株式会社ユニオンプレート | 《地域未来牽引企業》★各種手当・社員寮など福利厚生充実,29歳以下のポテンシャル採用！【メーカー営業】※未経験歓迎 正社員,
375,特許業務法人サンネクスト国際特許事務所 | マネージャー候補募集＊フレックスタイム制＊年間休日120日以上,裁量ある職場で活躍！【外国特許事務】☆賞与4ヶ月分☆土日休み 正社員,
376,株式会社ユニゾンベックス | 【自社内開発】★年休124日★リモートワークOK★月給28万円以上,【フロントエンドエンジニア(コーダー)】*実務未経験者歓迎！ 正社員,
377,ヤフー株式会社 | 日本最大級のユーザー数をほこる「Yahoo! JAPAN」,【ストアアドバイザー】リモートワーク★未経験者歓迎★福岡募集 契約社員,
378,ザ・サン・ストラテジック・ソリューションズ株式会社 | 【世界トップクラスのビジネス賞受賞／大手・官公庁と取引多数】,【プロジェクトマネージャー】*土日祝休 *フレックス *前給保証 正社員,
379,有限会社ソラ | 20～30代活躍中★完全週休2日制★残業ほぼなし★有給取得率9割,ブライダルジュエリーブランド『SORA』の【企画営業】*未経験OK 正社員,
380,独立行政法人石油天然ガス・金属鉱物資源機構 | 《日本の資源・エネルギーの安定供給確保を使命としています》,※千葉勤務【管理・研修部知的財産関連業務】◆未経験OK 契約社員,
381,独立行政法人石油天然ガス・金属鉱物資源機構 | 《日本の資源・エネルギーの安定供給確保を使命としています》,※東京勤務【法務・知的財産関連業務】◆未経験OK ◆残業少なめ 契約社員,
382,株式会社リジョブ | 社会貢献をビジネスで挑戦！約6年で売上約4倍の成長ベンチャー,未経験OK／大阪採用★チームで価値貢献する【求人メディア営業】 正社員,
383,株式会社ユニゾンベックス | 【プロ野球球団・大手電機メーカー・他有名企業と取引実績多数】,【Webエンジニア】*実務未経験者歓迎*年休124日以上*自社内開発 正社員,
384,ヤフー株式会社 | 日本最大級のユーザー数をほこる「Yahoo! JAPAN」,【ストアアドバイザー】リモートワーク★未経験者歓迎★東京募集 契約社員,
385,ヤフー株式会社 | 日本最大級のユーザー数をほこる「Yahoo! JAPAN」,【ストアアドバイザー】リモートワーク★未経験者歓迎★大阪募集 契約社員,
386,住友生命保険相互会社 | ＜都北支社＞◎赤羽勤務◎正社員◎土日休み◎退職金制度あり◎,【ライフデザイナー】まずはお気軽に会社見学へお越しください！ 正社員,
387,株式会社アソウ・アルファ | 《150年の歴史と実績/麻生グループ》U・Iターン支援有り！,【エンジニア】にイメチェンしませんか？★年休124日 正社員,
388,東芝テック株式会社 | ★東証一部上場 ★土日祝休み ★賞与4.8ヶ月（昨年実績）,POS業界シェアNo.1【ルート営業】★20～30代活躍中 ★未経験歓迎 正社員,
389,株式会社京王ＩＴソリューションズ | ★土日祝休み ★年間休日120日 ★京王グループの福利厚生も,京王電鉄グループ内で活躍する【社内SE】★残業月平均20時間程度 正社員,
390,株式会社キャンサースキャン | 実務未経験OK◆平均30代前半＆自由な社風◆フレックス制あり,ヘルスビックデータの【アナリティクス(データアナリスト)】 正社員,
391,CFL株式会社 | 『TOKYO働き方改革宣言企業』認定企業｜月給30万～50万円,【Ｗebディレクター】※一般職募集/土日祝休み/残業月20時間以内 正社員,
392,Career Channel株式会社 | 超絶おしゃれ/イケてないおじさん0名/木金6時間実働/服装自由,応募殺到☆超絶イケてる会社で超絶楽しい仕事【事務/総務/秘書】 正社員,
393,株式会社アンドパッド | 《業界のDX推進をリードするSaaS企業／累計87億円の資金調達》,施工管理アプリの【フィールドセールス（リーダー）】年休126日 正社員,
394,クリエイトソリューションズ株式会社 | ★日立グループなど大手との直取引の実績！★前期比130%の成長率,★7期連続増収増益！【営業】残業ほぼなし ★20～30代活躍中！ 正社員,
395,株式会社タイアップ21 | ☆大手ゼネコンと取引／官公庁案件多数／リモートワーク応相談,《業界経験者募集！》建築用金物工事の【積算】☆年齢不問 正社員,
396,株式会社アルプスビジネスサービス | 東証一部上場企業の100%子会社 ◎年間休日120日以上 ◎週休2日制,総合人材サービス企業の【営業職】愛知・神奈川募集★未経験歓迎 正社員,
397,株式会社ファングリー | ※2020年設立の新会社/年間売上 数千億円規模の企業案件多数,【Webコンテンツマーケティングの企画営業】大手・中堅企業中心 正社員,
398,ポスタス株式会社 | パーソルグループ：土日祝休み・年休123日・フルフレックス,若手活躍中！大手企業向けに自社サービスを提案する【SaaS営業】 正社員,
399,株式会社NTTデータ関西 | 【関西トップクラスのSIer】※年間休日122日 ※残業平均月21.3h,"公共,法人,金融系の【PL/PM】※リモートワーク・フレックス導入 正社員",
400,学校法人嘉悦学園 | <創立119年の歴史>★残業月平均20h/土日祝休み/時差出勤・在宅可,学園の次代を担う方を育成！【学校職員】★人物重視＆未経験歓迎 契約社員,
401,ヤフー株式会社 | 日本最大級のユーザー数を誇る「Yahoo! JAPAN」,【ビッグデータエンジニア】※データプラットフォームの開発など 正社員,
402,TSRソリューションズ株式会社 | 2008年の設立以来13年間黒字経営◎,最先端技術を扱う【ITソリューション営業】年収1000万円可能！ 正社員,
403,デジタル・アドバタイジング・コンソーシアム株式会社 | DAC,【アカウントディレクター(営業)】※メディア営業経験者歓迎！ 正社員,
404,株式会社アパートナー | 「アパマンショップ」など全国19店舗展開★残業月10~20h★土日休,職場のDXを推進する！【社内SE】★未経験OK＆経験が浅い方も歓迎 正社員,
405,株式会社日立システムズ | <人とITの力で、驚きと感動のサービスを>,サーバ・ネットワークの設計構築をお任せ【インフラエンジニア】 正社員,
406,株式会社George P. Johnson | 【イベント・マーケティング業界で世界TOPクラスの売上規模】,"""世界的に有名な企業""で活躍！【イベントプロデューサー】 正社員",
407,ヤフー株式会社 | 日本最大級のユーザー数を誇る「Yahoo! JAPAN」,【サービス・プラットフォーム開発エンジニア】※第二新卒も歓迎 正社員,
408,サンゴバン株式会社 | 全世界で約17万人の従業員を擁する、グローバル企業の日本法人,世界的グループで活躍！工業用・建設用研磨材製品の【提案営業】 正社員,
409,ソシム株式会社 | PC/IT書籍やデザイン書、ビジネス書など人気書籍を多数輩出,【書籍編集】★様々なジャンルの編集経験が活きる ★月給27万円~ 正社員,
410,株式会社ファングリー | ※2020年設立の新会社/年間売上 数千億円規模の企業案件多数,【Web・編集ディレクター】大手・上場・中堅企業との取引が中心 正社員,
411,株式会社メイテックフィルダーズ | 東証一部上場グループ／年収100万UPした先輩も！設計業務が93％,大手でスキルを磨く！【機械・電気設計エンジニア】※経験者募集 正社員,
412,ヤフー株式会社 | 日本最大級のユーザー数を誇る「Yahoo! JAPAN」,【DBエンジニア】※大規模データベースの運用 正社員,
413,株式会社リジョブ | 6年で売上約4倍。利益率約20倍に成長したソーシャルベンチャー,想いを結ぶ求人メディア／顧客貢献をチームで形に【事務総合職】 正社員,
414,セントラルジャパン株式会社 | ＜家具付寮完備＞★20～40代が活躍中！★WEB面接可★面接1回,【事務スタッフ】★パソコンスキル不問★時短勤務・週４勤務可 正社員,
415,ヤフー株式会社 | 日本最大級のユーザー数を誇る「Yahoo! JAPAN」,【システム企画】※無制限リモートワーク実施中 正社員,
416,PwCビジネスアシュアランス合同会社,【テクニカルスペシャリスト】（システム監査） 正社員,
417,株式会社フラット | Python・クラウドなど最新技術の案件多数！テレワーク案件80％！,【ITエンジニア】ゆる～く自由に働ける環境◎社内業務一切ナシ！ 正社員,
418,株式会社アークランド | ★食事代補助★月8～10日休み・残業5h以内！プライベート充実,未経験OK！病院にホッとできる空間を！【総合職(事務スタッフ)】 正社員,
419,有限責任監査法人トーマツ | デロイト トーマツ リスクサービス株式会社へ出向,【金融機関向けITコンサルタント】※開発・構築は行わず上流担当 正社員,
420,株式会社GMW | 自らの提案で会社利益に貢献→5～6割をインセンティブで還元！,未経験OK！【総合職（SES営業・エンジニア）】※35歳以下 正社員,
421,有限責任監査法人トーマツ | デロイト トーマツ リスクサービス株式会社へ出向,ＩＴアドバイザリー 正社員,
422,株式会社昭栄美術 | 業界トップクラスの歴史と実績／在宅・リモートワーク推進中！,ディスプレイ業界トップクラス！大規模イベント等の【提案営業】 正社員,
423,アスモ管理株式会社 | ▼自由度高く働ける環境 ▼駅チカ｜大阪府緊急雇用対策に賛同,スキルアップを目指せる【不動産営業】※完全週休2日制(土日祝) 正社員,
424,三井ホームエステート株式会社 | 【三井ホーム(株)の100%出資会社】家賃補助最大90%まで支給！,★東京募集★【賃貸管理営業】◎IUターン大歓迎 ◎完全週休2日制 正社員,
425,リプレックス株式会社 | 【東証一部上場CASIOグループ】*年俸600万円以上*年休120日以上,★前給UP確約＆全国リモート勤務可★【ITエンジニア】土日祝休み 正社員,
426,有限責任監査法人トーマツ,【データ分析コンサルタント】※業界未経験歓迎 正社員,
427,Global Japan AAP Consulting | 南インドに特化した日系コンサルティング企業！,日系企業のインド事業を支える【会計・税務担当コンサルタント】 正社員,
428,EYストラテジー・アンド・コンサルティング株式会社 | 世界150カ国以上で事業を展開するEYグループ,グローバルファームで経験を積む【システム監査】※業種未経験OK 正社員,
429,株式会社GMW | 自らの提案で会社利益に貢献→5～6割をインセンティブで還元！,リモート利用9割☆やりたいことを実現【エンジニア】※年齢不問 正社員,
430,株式会社レアゾン・ホールディングス | ＜新規事業を続々創出＞★駅チカ＆綺麗なオフィス★福利厚生充実,【採用アシスタント】*内勤業務*20代30代活躍中*土日祝休み 契約社員,
431,有限責任監査法人トーマツ,【システム監査・システムリスクコンサルタント】★第二新卒歓迎 正社員,
432,株式会社サークア | 【東証一部上場”駅探”グループ】年休120日～*フレックス制,自社サービスの【Web広告運用/営業】リモート導入100％*未経験◎ 正社員,
433,ユニ・チャーム株式会社 | 【東証一部上場】★転勤なし ★残業少なめ,女性が活躍中♪【営業職】業界未経験OK★直行直帰★土日祝休 正社員,
434,株式会社メディア工房 | 【占いや心理テストのコンテンツを配信】*未経験OK/月給28万円～,女性向けWEBサービスの【総合職(プロモーション/企画運用)】 正社員,
435,株式会社カカオピッコマ | 充実の福利厚生★年休120日以上★土日祝休み,ピッコマ運営【総合職(編集サポート／進行管理／リサーチャー)】 契約社員,
436,ＭＳ＆ＡＤアビリティワークス株式会社 | 《東証一部上場企業グループ》障がい者の活躍を促進する企業,【障がい者雇用管理】★年間休日123日以上★残業月平均10h程度 正社員,
437,さんぎょうい株式会社 | 健康経営優良法人（経済産業省認定）／月給23万円～／賞与年2回,【産業医コーディネーター（法人営業）】未経験OK／年休125日 正社員,
438,株式会社デジタリアス | ◎未経験入社9割以上◎月残業5h以内◎充実の研修制度,未経験歓迎【初級エンジニア】★年休150日以上★入社祝金15万円 正社員,
439,インフィニアス株式会社 | クラウドやストレージがアツイ★年休120日以上/残業月平均10h,"【ネットワークエンジニア】★AWS・Azure, 設計構築、運用保守 正社員",
440,株式会社レジット | 資格支援制度 / 服装・髪型自由 / 22年5月に道玄坂に拡大移転！,【Webデザイナー】★年収800万円も実現できる★フレックス制 正社員,
441,ランスタッド株式会社 | リモートで選考完結＊完全週休2日制/学歴不問/第二新卒歓迎！,充実サポートで不安が期待に◎手に職つける【ITサポート事務】 正社員,
442,アフラック生命保険株式会社 | 残業月平均20時間★完全週休2日制★土日祝休み,【代理店営業】在宅勤務あり/未経験者歓迎/初任地指定可能 正社員,
443,インフィニアス株式会社 | 自社サービス・受託・拡大中！★年休120日以上/残業月平均10h,【開発エンジニア】◆受託案件拡大中◆月給26万円以上 正社員,
444,マツダ株式会社 | ――☆年間休日121日／原則土日祝休み／その他福利厚生充実,≪広島≫【コネクティッドシステム開発(インフラ)】異業界出身OK 正社員,
445,エクスピーズ株式会社 | フルリモートでも結果を出す人材へ◆完全週休2日＆年間休日125日,子育て中の女性が大活躍中！これまでの経験が活かせる！【営業】 正社員,
446,株式会社ネオキャリア | 【働き方改革成功企業】◆前年比150％の成長事業　◆転勤なし,【総合職（営業事務／ヘルプデスク）】＊土日休・年休128日以上 正社員,
447,ノーバジェット株式会社 | #完全週休2日制（土日祝）#フレックスタイム制,企画やディレクションにも挑戦！【デザイナー・ディレクター】 正社員,
448,マツダ株式会社 | ――☆年間休日121日／原則土日祝休み／その他福利厚生充実,≪東京≫【コネクティッドシステム開発(アプリ)】異業界出身歓迎 正社員,
449,株式会社実正 | 創業41年『化粧品OEM企画製造』の老舗企業！,自社開発・製造をおこなう化粧品の【商品企画・マーケティング】 正社員,
450,株式会社マイナビ | ライフスタイルや就職等人生の様々な場面を支えるサービスを提供,【総合職（WEBディレクター）】◆安定環境で自社サイトの運営を 正社員,
451,GMOインターネット株式会社 | 【東証一部上場】★無料のカフェ＆バー・社内託児所あり,【Webアプリケーションエンジニア】★福岡勤務★土日祝休 正社員,
452,マツダ株式会社 | ――☆年間休日121日／原則土日祝休み／その他福利厚生充実,≪東京≫【コネクティッドシステム開発(インフラ)】異業界出身OK 正社員,
453,ノーバジェット株式会社 | 大手クライアントと関係を築く安定企業,【記事コンテンツの編集スタッフ】☆リモートワークを導入！ 正社員,
454,エスプラナード・ワン株式会社 | ホンダグループ直請け20年の安定性◎/自社サービスも拡大中,【ITエンジニア】＼前職給保証！／★未経験歓迎 ★残業月10H以内 正社員,
455,株式会社UNITED PRODUCTIONS | バラエティ・音楽・情報など多数/即日就業歓迎！/上場グループ,未経験◎しゃべくり007/Mステ/あちこちオードリー/笑コラ【AD】 正社員,
456,TIS株式会社 | 東証一部上場◆国内最大級プライムSIer◆サービス事業拡大中,ITエンジニア（アプリケーション開発／SE・PM・アーキテクト） 正社員,
457,マツダ株式会社 | ――☆年間休日121日／原則土日祝休み／その他福利厚生充実,≪広島≫【コネクティッドシステム開発(アプリ)】異業界出身歓迎 正社員,
458,TIS株式会社 | 東証一部上場◆国内最大級プライムSIer◆サービス事業拡大中,インフラエンジニア（大規模案件の提案・要件定義・設計～運用） 正社員,
459,日本引越倉庫株式会社 | ★社用車貸与★月2回の出社でOK★担当エリアは埼玉・神奈川,直行直帰OK！月給27万以上スタート！【営業スタッフ】 正社員,
460,HRnavi Joint Stock Company | ベトナムでの転職に特化した人材紹介会社です！,オフショア開発でチームを率いる！【PM】※3名募集！ 人材バンク登録,
461,TIS株式会社 | 東証一部上場◆国内最大級プライムSIer◆サービス事業拡大中,企画系総合職（新規ビジネス・サービス企画） 正社員,
462,GMOインターネット株式会社 | 【東証一部上場】社内託児所あり,【エンジニア（Webアプリ開発）】★大阪勤務★土日祝休 正社員,
463,HRnavi Joint Stock Company | ベトナムでの転職に特化した人材紹介会社です！,ベトナムで働く！オフショア開発【プロジェクトマネージャー】 人材バンク登録,
464,株式会社タイムリー | 《全国に8拠店を展開する総合広告代理店》リモートワーク実施中,オープニング募集【人材コーディネーター】土日祝休み/未経験OK 正社員,
465,株式会社スロウアイランズ | 直取引多数の安定企業／年休121日*完全週休2日(土日)*有給1H～可,【ITエンジニア】★前給与考慮★残業月10h以内★賞与年4回 正社員,
466,株式会社野村総合研究所 | （NRI）【東証一部上場】,【システムコンサルタント】ITアーキテクチャコンサル～設計構築 正社員,
467,パーソルワークスデザイン株式会社 | 【東証一部上場・パーソルグループ】フレックス制有・残業少なめ,業種未経験歓迎！【採用アシスタント】☆毎年正社員登用実績有 契約社員,
468,株式会社プラスジャム | ★残業月平均12h程度★年休120日以上★土日祝休み★在宅勤務OK,【Webデザイナー】コンセプト・企画から携わる／フレックス制 正社員,
469,株式会社野村総合研究所 | （NRI）【東証一部上場】,【システムコンサルタント】（企画～設計～開発） 正社員,
470,株式会社ファルコン | #リモートワーク実施中 #1時間単位の有給消化OK #時差通勤あり,自社内開発の【システムエンジニア】年間休日125日◆残業月20h程 正社員,
471,パーク２４株式会社 | 東証一部上場★未経験歓迎★年間休日125日、残業少,全国で広がるキャッシュレス決済端末【営業】★正社員登用あり 契約社員,
472,浪速運送株式会社 | 物流業界のリーディングカンパニー！原則土日祝休み！,＼創業98年の物流企業で、社内ITの進化を担う／【社内SE】 正社員,
473,株式会社久栄社 | 最先端の印刷技術で世の中に喜びと感動を与えている企業！,グッズ製作の【企画・進行管理】■土日祝休み／年休123日■ 正社員,
474,株式会社CENTO | 【前職給与以上を保証】年休125日/土日祝/残業月15h/フレックス,ゼロからキャリア設計できる！【ITエンジニア】*月31万円以上 正社員,
